{
  "id": "rfc-7540-http2",
  "title": "RFC 7540 - Hypertext Transfer Protocol Version 2 (HTTP/2)",
  "filename": "corpus/rfc-7540-http2.md",
  "source_url": "https://www.rfc-editor.org/rfc/rfc7540",
  "source_name": "ietf",
  "author": "M. Belshe, R. Peon, M. Thomson",
  "content_type": "rfc",
  "domain": "technology",
  "tags": [
    "rfc",
    "standards",
    "http2",
    "protocol",
    "web"
  ],
  "format": "md",
  "language": "en",
  "license": "fair-use-excerpt",
  "tone": "formal",
  "register": "jargon-heavy",
  "audience": "experts",
  "era": "2000-2025",
  "perspective": "third-person",
  "structure": "hierarchical-sections",
  "purpose": "document",
  "expertise_required": "expert",
  "quality_disposition": "exemplary",
  "authorship": "committee-drafted",
  "excerpted": true,
  "notes": "Excerpt from full RFC",
  "fetched_at": "2026-04-18"
}
