{
  "id": "bbc-ai-health-chatbot-trust",
  "title": "BBC: Can I trust health advice from an AI chatbot?",
  "filename": "corpus/bbc-ai-health-chatbot-trust.md",
  "source_url": "https://www.bbc.com/news/articles/clyepyy82kxo",
  "source_name": "bbc",
  "content_type": "feature-article",
  "domain": "health",
  "tags": [
    "ai",
    "health",
    "chatbot",
    "technology",
    "bbc",
    "explainer"
  ],
  "format": "md",
  "language": "en",
  "license": "fair-use-excerpt",
  "tone": "journalistic",
  "register": "plain",
  "audience": "general",
  "era": "2000-2025",
  "perspective": "third-person",
  "structure": "prose",
  "purpose": "analyze",
  "expertise_required": "generalist",
  "quality_disposition": "professional",
  "authorship": "human-written",
  "excerpted": false,
  "fetched_at": "2026-04-18"
}
