{
  "id": "go-rules-wiki",
  "title": "Rules of Go",
  "filename": "corpus/go-rules-wiki.md",
  "source_url": "https://en.wikipedia.org/wiki/Rules_of_Go",
  "source_name": "wikipedia",
  "content_type": "rules-of-game",
  "domain": "games",
  "tags": [
    "go",
    "board-game",
    "rules"
  ],
  "format": "md",
  "language": "en",
  "license": "cc-by-sa",
  "tone": "formal",
  "register": "plain",
  "audience": "general",
  "era": "2000-2025",
  "perspective": "third-person",
  "structure": "hierarchical-sections",
  "purpose": "instruct",
  "expertise_required": "domain-adjacent",
  "quality_disposition": "exemplary",
  "authorship": "committee-drafted",
  "excerpted": false,
  "fetched_at": "2026-04-18"
}
