{
  "id": "rotten-tomatoes-wiki",
  "title": "Rotten Tomatoes (Wikipedia)",
  "filename": "corpus/rotten-tomatoes-wiki.md",
  "source_url": "https://en.wikipedia.org/wiki/Rotten_Tomatoes",
  "source_name": "wikipedia",
  "content_type": "wikipedia-article",
  "domain": "film",
  "tags": [
    "aggregator",
    "film-criticism",
    "web"
  ],
  "format": "md",
  "language": "en",
  "license": "cc-by-sa",
  "tone": "informational",
  "register": "plain",
  "audience": "general",
  "era": "2000-2025",
  "perspective": "third-person",
  "structure": "hierarchical-sections",
  "purpose": "inform",
  "expertise_required": "generalist",
  "quality_disposition": "professional",
  "authorship": "committee-drafted",
  "excerpted": false,
  "fetched_at": "2026-04-18"
}
