{
  "id": "biden-sotu-2024",
  "title": "State of the Union Address (Biden, 2024)",
  "filename": "corpus/biden-sotu-2024.md",
  "source_url": "https://www.whitehouse.gov/briefing-room/speeches-remarks/2024/03/07/remarks-of-president-joe-biden-state-of-the-union-address-as-prepared-for-delivery-2/",
  "source_name": "whitehouse-gov",
  "author": "Joseph R. Biden Jr.",
  "content_type": "speech",
  "domain": "politics",
  "tags": [
    "21st-century",
    "state-of-the-union"
  ],
  "format": "md",
  "language": "en",
  "license": "government-work",
  "tone": "persuasive",
  "register": "plain",
  "audience": "general",
  "era": "2000-2025",
  "perspective": "first-person",
  "structure": "prose",
  "purpose": "persuade",
  "expertise_required": "generalist",
  "quality_disposition": "professional",
  "authorship": "committee-drafted",
  "excerpted": false,
  "fetched_at": "2026-04-18"
}
