{
  "id": "bitcoin-wiki",
  "title": "Bitcoin",
  "filename": "corpus/bitcoin-wiki.md",
  "source_url": "https://en.wikipedia.org/wiki/Bitcoin",
  "source_name": "wikipedia",
  "content_type": "wikipedia-article",
  "domain": "finance",
  "tags": [
    "cryptocurrency",
    "digital-currency",
    "blockchain",
    "satoshi"
  ],
  "format": "md",
  "language": "en",
  "license": "cc-by-sa",
  "tone": "informational",
  "register": "plain",
  "audience": "general",
  "era": "2000-2025",
  "perspective": "third-person",
  "structure": "hierarchical-sections",
  "purpose": "inform",
  "expertise_required": "generalist",
  "quality_disposition": "professional",
  "authorship": "committee-drafted",
  "excerpted": false,
  "fetched_at": "2026-04-18"
}
