{
  "id": "zstd-readme",
  "title": "Zstandard (zstd) README",
  "filename": "corpus/zstd-readme.md",
  "source_name": "github",
  "content_type": "readme",
  "domain": "technology",
  "tags": [
    "zstd",
    "compression",
    "facebook",
    "algorithm",
    "c"
  ],
  "format": "md",
  "language": "en",
  "license": "fair-use-excerpt",
  "tone": "technical",
  "register": "jargon-heavy",
  "audience": "professionals-in-field",
  "era": "2000-2025",
  "perspective": "third-person",
  "structure": "hierarchical-sections",
  "purpose": "inform",
  "expertise_required": "expert",
  "quality_disposition": "professional",
  "authorship": "corporate",
  "excerpted": false,
  "fetched_at": "2026-04-18"
}
