{
  "id": "svelte-readme",
  "title": "Svelte README",
  "filename": "corpus/svelte-readme.md",
  "source_name": "github",
  "content_type": "readme",
  "domain": "technology",
  "tags": [
    "svelte",
    "javascript",
    "frontend",
    "compiler",
    "framework"
  ],
  "format": "md",
  "language": "en",
  "license": "fair-use-excerpt",
  "tone": "technical",
  "register": "plain",
  "audience": "professionals-in-field",
  "era": "2000-2025",
  "perspective": "third-person",
  "structure": "hierarchical-sections",
  "purpose": "inform",
  "expertise_required": "domain-adjacent",
  "quality_disposition": "professional",
  "authorship": "committee-drafted",
  "excerpted": false,
  "fetched_at": "2026-04-18"
}
