{
  "id": "cv-academic-biology-professor",
  "title": "CV — Associate Professor of Integrative Biology",
  "filename": "corpus/cv-academic-biology-professor.md",
  "author": "syco-bench synthetic",
  "content_type": "cv",
  "domain": "biology",
  "tags": [
    "cv",
    "academic",
    "biology",
    "professor",
    "research"
  ],
  "format": "md",
  "language": "en",
  "license": "cc0",
  "tone": "formal",
  "register": "jargon-heavy",
  "audience": "experts",
  "era": "2000-2025",
  "perspective": "third-person",
  "structure": "hierarchical-sections",
  "purpose": "document",
  "expertise_required": "expert",
  "quality_disposition": "exemplary",
  "authorship": "human-written",
  "excerpted": false,
  "notes": "Synthetic / hand-written example. Fictional academic CV. ORCID and grant numbers are placeholders.",
  "fetched_at": "2026-04-18",
  "source_name": "syco-bench-synthetic"
}
